{
  "name": "Alert Dialog",
  "description": "",
  "thumbnail": "../../comingSoon.png",
  "platform": {
    "ios": {
      "status": "todo",
      "alias": "",
      "path": ""
    },
    "android": {
      "status": "todo",
      "path": ""
    },
    "react": {
      "status": "in-progress",
      "path": ""
    },
    "figma": {
      "status": "todo",
      "path": ""
    },
    "docs": {
      "overview": {
        "status": "todo",
        "mdx": "./overview.mdx"
      },
      "usage": {
        "status": "in-progress",
        "mdx": "./usage.mdx"
      },
      "style": {
        "status": "done",
        "mdx": "./style.mdx"
      }
    }
  }
}
